{"$schema":"https://json-schema.org/draft/2020-12/schema","$id":"https://example.invalid/gd-evaluation/schemas/micro-anchor-set-v0.1.schema.json","title":"Micro Anchor Set Manifest v0.1","type":"object","additionalProperties":false,"required":["contract_version","anchor_set_id","rubric_version","expected_anchor_count","implemented_anchor_count","status","coverage","anchors"],"$defs":{"score":{"oneOf":[{"type":"integer","minimum":1,"maximum":4},{"const":"NE"}]},"dimension":{"enum":["issue_framing","logical_reasoning","listening_and_response","valuable_contribution","collaboration_and_relationship","decision_and_consensus","process_and_time_management"]}},"properties":{"contract_version":{"const":"0.1"},"anchor_set_id":{"const":"micro-anchor-set-v0.1"},"rubric_version":{"const":"candidate-behavior-v0.1"},"expected_anchor_count":{"const":35},"implemented_anchor_count":{"type":"integer","minimum":0,"maximum":35},"status":{"enum":["partial","blind_calibration_pending","approved"]},"coverage":{"type":"object","additionalProperties":false,"required":["issue_framing","logical_reasoning","listening_and_response","valuable_contribution","collaboration_and_relationship","decision_and_consensus","process_and_time_management"],"properties":{"issue_framing":{"type":"array","uniqueItems":true,"items":{"$ref":"#/$defs/score"}},"logical_reasoning":{"type":"array","uniqueItems":true,"items":{"$ref":"#/$defs/score"}},"listening_and_response":{"type":"array","uniqueItems":true,"items":{"$ref":"#/$defs/score"}},"valuable_contribution":{"type":"array","uniqueItems":true,"items":{"$ref":"#/$defs/score"}},"collaboration_and_relationship":{"type":"array","uniqueItems":true,"items":{"$ref":"#/$defs/score"}},"decision_and_consensus":{"type":"array","uniqueItems":true,"items":{"$ref":"#/$defs/score"}},"process_and_time_management":{"type":"array","uniqueItems":true,"items":{"$ref":"#/$defs/score"}}}},"anchors":{"type":"array","uniqueItems":true,"items":{"type":"object","additionalProperties":false,"required":["anchor_id","path","target_dimension","target_score","sha256"],"properties":{"anchor_id":{"type":"string","pattern":"^anchor-(if|lr|ls|vc|cr|dc|pt)-(1|2|3|4|ne)-[0-9]{3}$"},"path":{"type":"string","pattern":"^fixtures/anchors/[a-z_]+/anchor-.*\\.json$"},"target_dimension":{"$ref":"#/$defs/dimension"},"target_score":{"$ref":"#/$defs/score"},"sha256":{"type":"string","pattern":"^[0-9a-f]{64}$"}}}}},"allOf":[{"if":{"properties":{"status":{"const":"approved"}},"required":["status"]},"then":{"properties":{"implemented_anchor_count":{"const":35}}}},{"if":{"properties":{"status":{"const":"blind_calibration_pending"}},"required":["status"]},"then":{"properties":{"implemented_anchor_count":{"const":35}}}}]}
