{"contract_version":"0.1","anchor_set_id":"micro-anchor-set-v0.1","rubric_version":"candidate-behavior-v0.1","expected_anchor_count":35,"implemented_anchor_count":35,"status":"blind_calibration_pending","coverage":{"issue_framing":[1,2,3,4,"NE"],"logical_reasoning":[1,2,3,4,"NE"],"listening_and_response":[1,2,3,4,"NE"],"valuable_contribution":[1,2,3,4,"NE"],"collaboration_and_relationship":[1,2,3,4,"NE"],"decision_and_consensus":[1,2,3,4,"NE"],"process_and_time_management":[1,2,3,4,"NE"]},"anchors":[{"anchor_id":"anchor-if-1-001","path":"fixtures/anchors/issue_framing/anchor-if-1-001.json","target_dimension":"issue_framing","target_score":1,"sha256":"79e3f08594a88880be25f5041a9a01bed41a66f5fa96c596ded7e99c7a0d1cf0"},{"anchor_id":"anchor-if-2-001","path":"fixtures/anchors/issue_framing/anchor-if-2-001.json","target_dimension":"issue_framing","target_score":2,"sha256":"c93d235af3a966ecafde4ae777cc3759c7f25cd63dae0c366743766664e8699b"},{"anchor_id":"anchor-if-3-001","path":"fixtures/anchors/issue_framing/anchor-if-3-001.json","target_dimension":"issue_framing","target_score":3,"sha256":"598cb9045ff6f8918b09bc50ac60ccf928b2dbc83bc9f477a7117ed0423a99dd"},{"anchor_id":"anchor-if-4-001","path":"fixtures/anchors/issue_framing/anchor-if-4-001.json","target_dimension":"issue_framing","target_score":4,"sha256":"6126cb803448ae08de9fa0321edecfbed299f364a7856e3e9bd08a9db3858221"},{"anchor_id":"anchor-if-ne-001","path":"fixtures/anchors/issue_framing/anchor-if-ne-001.json","target_dimension":"issue_framing","target_score":"NE","sha256":"ef4d1f618575f8775858681d2a4361402e4d6f38baf08545d6c1e50f8e303ebe"},{"anchor_id":"anchor-lr-1-001","path":"fixtures/anchors/logical_reasoning/anchor-lr-1-001.json","target_dimension":"logical_reasoning","target_score":1,"sha256":"5ebd996181d4dd11a721e5aed65e5fd0e71a4c233f80cb766d831db5999cf157"},{"anchor_id":"anchor-lr-2-001","path":"fixtures/anchors/logical_reasoning/anchor-lr-2-001.json","target_dimension":"logical_reasoning","target_score":2,"sha256":"fe8a287c203bf432a70427b65028b2ad42dc092aef4d6ff12c8ce5604dd5e0d0"},{"anchor_id":"anchor-lr-3-001","path":"fixtures/anchors/logical_reasoning/anchor-lr-3-001.json","target_dimension":"logical_reasoning","target_score":3,"sha256":"bd64f6f64b7b9b4a5b663570bf8fdd0bc90642908186e059d121f34516538a87"},{"anchor_id":"anchor-lr-4-001","path":"fixtures/anchors/logical_reasoning/anchor-lr-4-001.json","target_dimension":"logical_reasoning","target_score":4,"sha256":"62b09f8fec7b0eee3d7dbeb8339622b2bb861d0f9da7beed4c375bf53a7eade2"},{"anchor_id":"anchor-lr-ne-001","path":"fixtures/anchors/logical_reasoning/anchor-lr-ne-001.json","target_dimension":"logical_reasoning","target_score":"NE","sha256":"5a0a3b5d2170a7005de69c2c519b38b70d39dde33ebf220a96ccd64c0ad13619"},{"anchor_id":"anchor-ls-1-001","path":"fixtures/anchors/listening_and_response/anchor-ls-1-001.json","target_dimension":"listening_and_response","target_score":1,"sha256":"12e7766b46b40306968c67ac78e4a6b29eb4df87b787e7637e5fe280c1646e53"},{"anchor_id":"anchor-ls-2-001","path":"fixtures/anchors/listening_and_response/anchor-ls-2-001.json","target_dimension":"listening_and_response","target_score":2,"sha256":"7b8e051b44de2248c0772016fc7d4aa39204a5acced2bcb4b8e505f6aee24693"},{"anchor_id":"anchor-ls-3-001","path":"fixtures/anchors/listening_and_response/anchor-ls-3-001.json","target_dimension":"listening_and_response","target_score":3,"sha256":"7670166538ad2f669c8f114b24aece4726d3ca68530d0df2da28370cfe53d83a"},{"anchor_id":"anchor-ls-4-001","path":"fixtures/anchors/listening_and_response/anchor-ls-4-001.json","target_dimension":"listening_and_response","target_score":4,"sha256":"b5d852cadf3984db4970f2d0e33d05de71a9328d9fc725b5e6ed4d4e6ce1f9bd"},{"anchor_id":"anchor-ls-ne-001","path":"fixtures/anchors/listening_and_response/anchor-ls-ne-001.json","target_dimension":"listening_and_response","target_score":"NE","sha256":"247a5f55686f072a5a985439d5782a428291df71f0b54ad6e774c79355092a13"},{"anchor_id":"anchor-vc-1-001","path":"fixtures/anchors/valuable_contribution/anchor-vc-1-001.json","target_dimension":"valuable_contribution","target_score":1,"sha256":"a60792ab2e195007fc8f589ca8ecf82a9263d53233bbde8cf51e8e2044ccbc82"},{"anchor_id":"anchor-vc-2-001","path":"fixtures/anchors/valuable_contribution/anchor-vc-2-001.json","target_dimension":"valuable_contribution","target_score":2,"sha256":"bfc1c832893500cfb27697f344fecb03cb724d0449901b7e13671885f5908945"},{"anchor_id":"anchor-vc-3-001","path":"fixtures/anchors/valuable_contribution/anchor-vc-3-001.json","target_dimension":"valuable_contribution","target_score":3,"sha256":"813fed6642f289cff203d6e7a9957cc7dc8179eaff7ef8863353fbcf7d6c6aeb"},{"anchor_id":"anchor-vc-4-001","path":"fixtures/anchors/valuable_contribution/anchor-vc-4-001.json","target_dimension":"valuable_contribution","target_score":4,"sha256":"199d401d8d6d2aac1a592e695806a7c5b107b56847284a3fa4c56740aeac6cb1"},{"anchor_id":"anchor-vc-ne-001","path":"fixtures/anchors/valuable_contribution/anchor-vc-ne-001.json","target_dimension":"valuable_contribution","target_score":"NE","sha256":"ca18481a538ad44cdadbaa4a14ef481d6a5e3ac1612c7f3526bb2a3906519847"},{"anchor_id":"anchor-cr-1-001","path":"fixtures/anchors/collaboration_and_relationship/anchor-cr-1-001.json","target_dimension":"collaboration_and_relationship","target_score":1,"sha256":"8892435ca366343560ab05eb25d6e8f8aee188c934053db26224bcb4a816a457"},{"anchor_id":"anchor-cr-2-001","path":"fixtures/anchors/collaboration_and_relationship/anchor-cr-2-001.json","target_dimension":"collaboration_and_relationship","target_score":2,"sha256":"b59b50e2d91f4f800eae637c2226d0791c7f114c27da6c554610e2778810e2b3"},{"anchor_id":"anchor-cr-3-001","path":"fixtures/anchors/collaboration_and_relationship/anchor-cr-3-001.json","target_dimension":"collaboration_and_relationship","target_score":3,"sha256":"7c22340f19cc5a8aaeb2cdf0ac994f9ddec17c4990e8b09904327e2578a7591f"},{"anchor_id":"anchor-cr-4-001","path":"fixtures/anchors/collaboration_and_relationship/anchor-cr-4-001.json","target_dimension":"collaboration_and_relationship","target_score":4,"sha256":"27e30a61fe7bad7a06468dd1d0946ab16d4b1a2b6c8c0b4d09fea8f64e134101"},{"anchor_id":"anchor-cr-ne-001","path":"fixtures/anchors/collaboration_and_relationship/anchor-cr-ne-001.json","target_dimension":"collaboration_and_relationship","target_score":"NE","sha256":"88cb22ae89471af0a92436e23a78d1b8cec1197cbdb18b1b3df86bdd15fcaabe"},{"anchor_id":"anchor-dc-1-001","path":"fixtures/anchors/decision_and_consensus/anchor-dc-1-001.json","target_dimension":"decision_and_consensus","target_score":1,"sha256":"35b6428f9862ebecba7367ce022a8ec6008a77f7127f30a53e94bbf0a1b0c38c"},{"anchor_id":"anchor-dc-2-001","path":"fixtures/anchors/decision_and_consensus/anchor-dc-2-001.json","target_dimension":"decision_and_consensus","target_score":2,"sha256":"8c1b2199d5702b073d0b7e2a34fdb99284605de3d93b2250f86c79a0f69a7a5c"},{"anchor_id":"anchor-dc-3-001","path":"fixtures/anchors/decision_and_consensus/anchor-dc-3-001.json","target_dimension":"decision_and_consensus","target_score":3,"sha256":"0dc0c42b6818da89865409cf7c25d79c575c638317a2dd7ac36544b54faefa1d"},{"anchor_id":"anchor-dc-4-001","path":"fixtures/anchors/decision_and_consensus/anchor-dc-4-001.json","target_dimension":"decision_and_consensus","target_score":4,"sha256":"a29cad7aa36aa15a86058ea6a0d4e7a16ccb0d51f23965e802f9a7c36a9b85af"},{"anchor_id":"anchor-dc-ne-001","path":"fixtures/anchors/decision_and_consensus/anchor-dc-ne-001.json","target_dimension":"decision_and_consensus","target_score":"NE","sha256":"0b941ec0f45c22973d522b11d93f6fea8c7cb9f99d113b82703825a67058186f"},{"anchor_id":"anchor-pt-1-001","path":"fixtures/anchors/process_and_time_management/anchor-pt-1-001.json","target_dimension":"process_and_time_management","target_score":1,"sha256":"6450275f9d22b0088d78edd8642d645ae271959c8a5499bf0fb4f3022369d1d4"},{"anchor_id":"anchor-pt-2-001","path":"fixtures/anchors/process_and_time_management/anchor-pt-2-001.json","target_dimension":"process_and_time_management","target_score":2,"sha256":"997c04c63323a3e29908740321d20d21db18308c3fea1a9d14a3bc268b6c0f00"},{"anchor_id":"anchor-pt-3-001","path":"fixtures/anchors/process_and_time_management/anchor-pt-3-001.json","target_dimension":"process_and_time_management","target_score":3,"sha256":"357bb03b3132c432000ecb1ae22bcd8cf6ba07070d5fff9f0c8a031f99691c1e"},{"anchor_id":"anchor-pt-4-001","path":"fixtures/anchors/process_and_time_management/anchor-pt-4-001.json","target_dimension":"process_and_time_management","target_score":4,"sha256":"e4da6732e8de14967b30bd70e9f9e01a9ed9a3643e4d1099e7432eed409a58b1"},{"anchor_id":"anchor-pt-ne-001","path":"fixtures/anchors/process_and_time_management/anchor-pt-ne-001.json","target_dimension":"process_and_time_management","target_score":"NE","sha256":"7a31418c4cc76a732e4f4fb53e2db5fe04c593f6d2f564df7cd7f71fdb493389"}]}
